{"schemaVersion":"1.0.0","generatedAt":"2026-10-14T02:13:25.278956Z","status":"partial","lastSuccessfulCheckAt":"2026-10-10T10:16:39.118957Z","documentGeneratedAt":"2026-10-13T21:29:33.187489Z","newestVerifiedStoryAt":"2026-10-13T04:05:00Z","sources":{"nasa":{"name":"NASA","staleAfterHours":36,"lastAttemptAt":"2026-10-13T10:00:01.886016Z","lastSuccessAt":"2026-10-13T10:00:01.886016Z","lastNewStoryAt":"2026-10-13T10:00:01.886016Z","errors":[],"candidateCount":10,"acceptedCount":3,"deferredCount":2,"rejectedCount":1,"lastFullAttemptAt":"2026-10-13T10:00:01.886016Z"},"jpl":{"name":"NASA JPL","staleAfterHours":36,"lastAttemptAt":"2026-10-13T16:42:20.049697Z","lastSuccessAt":"2026-10-13T10:00:01.886016Z","lastNewStoryAt":"2026-10-10T10:16:39.118957Z","errors":[],"candidateCount":1,"acceptedCount":1,"deferredCount":0,"rejectedCount":0,"lastFullAttemptAt":"2026-10-13T10:00:01.886016Z","failedUrls":[],"feedFailed":false,"retryCount":0,"nextRetryAt":null},"esa":{"name":"ESA","staleAfterHours":36,"lastAttemptAt":"2026-10-14T02:13:25.278956Z","lastSuccessAt":"2026-10-13T10:00:01.886016Z","lastNewStoryAt":"2026-10-10T10:16:39.118957Z","errors":["https://www.esa.int/Science_Exploration/Space_Science/Smile/Science_begins_for_Smile: ValueError: evidence classification requires an article quote"],"candidateCount":1,"acceptedCount":0,"deferredCount":0,"rejectedCount":0,"lastFullAttemptAt":"2026-10-13T10:00:01.886016Z","failedUrls":["https://www.esa.int/Science_Exploration/Space_Science/Smile/Science_begins_for_Smile"],"feedFailed":false,"retryCount":4,"nextRetryAt":"2026-10-14T08:13:25.278956Z"},"nsf":{"name":"NSF","staleAfterHours":36,"lastAttemptAt":"2026-10-13T21:29:33.187489Z","lastSuccessAt":"2026-10-13T16:42:20.049697Z","lastNewStoryAt":"2026-10-10T10:16:39.118957Z","errors":[],"candidateCount":4,"acceptedCount":0,"deferredCount":0,"rejectedCount":1,"lastFullAttemptAt":"2026-10-13T10:00:01.886016Z","failedUrls":[],"feedFailed":false,"retryCount":0,"nextRetryAt":null},"umich":{"name":"University of Michigan News","staleAfterHours":36,"lastAttemptAt":"2026-10-13T19:00:39.612253Z","lastSuccessAt":"2026-10-13T10:00:01.886016Z","lastNewStoryAt":"2026-10-13T10:00:01.886016Z","errors":[],"candidateCount":1,"acceptedCount":1,"deferredCount":0,"rejectedCount":0,"lastFullAttemptAt":"2026-10-13T10:00:01.886016Z","failedUrls":[],"feedFailed":false,"retryCount":0,"nextRetryAt":null}},"error":"Incomplete source checks: esa","metrics":{"verifiedStories":46,"sourceCounts":{"ESA":8,"NASA":14,"NASA JPL":8,"NSF":8,"University of Michigan News":8},"topicCounts":{"astronomy":23,"biology":4,"climate":1,"computer-science":1,"earth-science":12,"economics":1,"education":1,"engineering":2,"geology":2,"health":4,"law":1,"law & politics":2,"materials-research":1,"physics":14,"planetary-science":1,"politics":1,"social-science":4,"technology":25},"newestStoryAgeHours":22.14,"maxPublicationLagHours":1114.28}}