{"schemaVersion":"1.0.0","generatedAt":"2026-10-13T16:40:22.630273Z","status":"partial","lastSuccessfulCheckAt":"2026-10-10T10:16:39.118957Z","documentGeneratedAt":"2026-10-13T16:40:22.630273Z","newestVerifiedStoryAt":"2026-10-13T04:05:00Z","sources":{"nasa":{"name":"NASA","staleAfterHours":36,"lastAttemptAt":"2026-10-13T10:00:01.886016Z","lastSuccessAt":"2026-10-13T10:00:01.886016Z","lastNewStoryAt":"2026-10-13T10:00:01.886016Z","errors":[],"candidateCount":10,"acceptedCount":3,"deferredCount":2,"rejectedCount":1,"lastFullAttemptAt":"2026-10-13T10:00:01.886016Z"},"jpl":{"name":"NASA JPL","staleAfterHours":36,"lastAttemptAt":"2026-10-13T10:00:01.886016Z","lastSuccessAt":"2026-10-13T10:00:01.886016Z","lastNewStoryAt":"2026-10-10T10:16:39.118957Z","errors":["https://www.nasa.gov/missions/jason-cs-sentinel-6/how-2-us-european-satellites-are-studying-hurricanes-during-el-nino/: ValueError: finding quote not present in article"],"candidateCount":10,"acceptedCount":2,"deferredCount":0,"rejectedCount":3,"lastFullAttemptAt":"2026-10-13T10:00:01.886016Z"},"esa":{"name":"ESA","staleAfterHours":36,"lastAttemptAt":"2026-10-13T10:00:01.886016Z","lastSuccessAt":"2026-10-13T10:00:01.886016Z","lastNewStoryAt":"2026-10-10T10:16:39.118957Z","errors":["https://www.esa.int/ESA_Multimedia/Images/2026/10/Webb_captures_commotion_from_nebula_s_stellar_jets: ValueError: finding quote not present in article","https://www.esa.int/Science_Exploration/Space_Science/Smile/Science_begins_for_Smile: ValueError: evidence classification requires an article quote"],"candidateCount":15,"acceptedCount":2,"deferredCount":7,"rejectedCount":3,"lastFullAttemptAt":"2026-10-13T10:00:01.886016Z"},"nsf":{"name":"NSF","staleAfterHours":36,"lastAttemptAt":"2026-10-13T10:00:01.886016Z","lastSuccessAt":"2026-10-10T10:16:39.118957Z","lastNewStoryAt":"2026-10-10T10:16:39.118957Z","errors":["HTTPError: HTTP Error 403: "],"candidateCount":0,"acceptedCount":0,"deferredCount":0,"rejectedCount":0,"lastFullAttemptAt":"2026-10-13T10:00:01.886016Z"},"umich":{"name":"University of Michigan News","staleAfterHours":36,"lastAttemptAt":"2026-10-13T10:00:01.886016Z","lastSuccessAt":"2026-10-13T10:00:01.886016Z","lastNewStoryAt":"2026-10-13T10:00:01.886016Z","errors":["https://news.umich.edu/as-voters-weigh-incumbents-u-m-research-complicates-case-for-congressional-term-limits/: ValueError: caveatQuote not present in article"],"candidateCount":20,"acceptedCount":2,"deferredCount":13,"rejectedCount":1,"lastFullAttemptAt":"2026-10-13T10:00:01.886016Z"}},"error":"Incomplete source checks: jpl, esa, nsf, umich","metrics":{"verifiedStories":47,"sourceCounts":{"ESA":8,"NASA":14,"NASA JPL":8,"NSF":9,"University of Michigan News":8},"topicCounts":{"astronomy":24,"biology":4,"climate":1,"computer-science":1,"earth-science":12,"economics":1,"education":1,"engineering":2,"geology":2,"health":4,"law":2,"law & politics":1,"materials-research":1,"physics":14,"planetary-science":1,"politics":2,"social-science":5,"technology":26},"newestStoryAgeHours":12.59,"maxPublicationLagHours":1114.28}}