{"schemaVersion":"1.0.0","generatedAt":"2026-10-18T10:14:03.151044Z","status":"partial","lastSuccessfulCheckAt":"2026-10-17T11:49:01.701877Z","documentGeneratedAt":"2026-10-18T10:14:03.151044Z","newestVerifiedStoryAt":"2026-10-18T04:05:00Z","sources":{"nasa":{"name":"NASA","staleAfterHours":36,"lastAttemptAt":"2026-10-18T10:14:03.151044Z","lastSuccessAt":"2026-10-18T10:14:03.151044Z","lastNewStoryAt":"2026-10-18T10:14:03.151044Z","errors":[],"candidateCount":10,"acceptedCount":3,"deferredCount":6,"rejectedCount":1,"lastFullAttemptAt":"2026-10-18T10:14:03.151044Z","failedUrls":[],"feedFailed":false,"retryCount":0,"nextRetryAt":null},"jpl":{"name":"NASA JPL","staleAfterHours":36,"lastAttemptAt":"2026-10-18T10:14:03.151044Z","lastSuccessAt":"2026-10-18T10:14:03.151044Z","lastNewStoryAt":"2026-10-14T10:00:06.638546Z","errors":[],"candidateCount":10,"acceptedCount":4,"deferredCount":4,"rejectedCount":2,"lastFullAttemptAt":"2026-10-18T10:14:03.151044Z","failedUrls":[],"feedFailed":false,"retryCount":0,"nextRetryAt":null},"esa":{"name":"ESA","staleAfterHours":36,"lastAttemptAt":"2026-10-18T10:14:03.151044Z","lastSuccessAt":"2026-10-18T10:14:03.151044Z","lastNewStoryAt":"2026-10-14T10:00:06.638546Z","errors":["https://www.esa.int/Science_Exploration/Space_Science/Mars_Express/Mars_s_oddest_cloud_may_be_even_odder_than_we_thought: ValueError: unverified paper URL"],"candidateCount":15,"acceptedCount":3,"deferredCount":6,"rejectedCount":5,"lastFullAttemptAt":"2026-10-18T10:14:03.151044Z","failedUrls":["https://www.esa.int/Science_Exploration/Space_Science/Mars_Express/Mars_s_oddest_cloud_may_be_even_odder_than_we_thought"],"feedFailed":false,"retryCount":1,"nextRetryAt":"2026-10-18T11:14:03.151044Z"},"nsf":{"name":"NSF","staleAfterHours":36,"lastAttemptAt":"2026-10-18T10:14:03.151044Z","lastSuccessAt":"2026-10-18T10:14:03.151044Z","lastNewStoryAt":"2026-10-14T10:00:06.638546Z","errors":[],"candidateCount":15,"acceptedCount":0,"deferredCount":8,"rejectedCount":3,"lastFullAttemptAt":"2026-10-18T10:14:03.151044Z","failedUrls":[],"feedFailed":false,"retryCount":0,"nextRetryAt":null},"umich":{"name":"University of Michigan News","staleAfterHours":36,"lastAttemptAt":"2026-10-18T10:14:03.151044Z","lastSuccessAt":"2026-10-18T10:14:03.151044Z","lastNewStoryAt":"2026-10-17T10:01:38.386991Z","errors":[],"candidateCount":20,"acceptedCount":4,"deferredCount":15,"rejectedCount":0,"lastFullAttemptAt":"2026-10-18T10:14:03.151044Z","failedUrls":[],"feedFailed":false,"retryCount":0,"nextRetryAt":null}},"error":"Incomplete source checks: esa","metrics":{"verifiedStories":72,"sourceCounts":{"ESA":9,"NASA":26,"NASA JPL":10,"NSF":9,"University of Michigan News":18},"topicCounts":{"astronomy":34,"biology":9,"climate":2,"computer-science":1,"earth-science":15,"ecology":1,"economics":1,"education":1,"environment":3,"geology":1,"health":9,"human dimensions":1,"law":1,"law & politics":2,"materials-research":1,"physics":20,"planetary science":1,"planetary-science":1,"politics":2,"social-science":12,"sustainability":1,"technology":43,"wildfires":1},"newestStoryAgeHours":6.15,"maxPublicationLagHours":1114.28}}