{"schemaVersion":"1.0.0","generatedAt":"2026-10-19T15:30:03.814548Z","status":"partial","lastSuccessfulCheckAt":"2026-10-18T20:05:50.950465Z","documentGeneratedAt":"2026-10-19T10:14:42.592285Z","newestVerifiedStoryAt":"2026-10-19T04:05:00Z","sources":{"nasa":{"name":"NASA","staleAfterHours":36,"lastAttemptAt":"2026-10-19T10:14:42.592285Z","lastSuccessAt":"2026-10-19T10:14:42.592285Z","lastNewStoryAt":"2026-10-19T10:14:42.592285Z","errors":[],"candidateCount":10,"acceptedCount":4,"deferredCount":6,"rejectedCount":0,"lastFullAttemptAt":"2026-10-19T10:14:42.592285Z","failedUrls":[],"feedFailed":false,"retryCount":0,"nextRetryAt":null},"jpl":{"name":"NASA JPL","staleAfterHours":36,"lastAttemptAt":"2026-10-19T15:30:03.814548Z","lastSuccessAt":"2026-10-19T10:14:42.592285Z","lastNewStoryAt":"2026-10-14T10:00:06.638546Z","errors":["https://science.nasa.gov/earth/nasa-satellites-observe-historic-2026-el-nino/: LLMError: HTTP 402: {\"error\":{\"message\":\"This request requires more credits, or fewer max_tokens. You requested up to 65535 tokens, but can only afford 3636. To increase, visit https://openrouter.ai/settings/credits and add more credits\",\"code\":402,\"","https://www.nasa.gov/missions/moon-base/nasa-jpl-testing-readies-voyager-technologies-lander-for-moon-mission/: LLMError: HTTP 402: {\"error\":{\"message\":\"This request requires more credits, or fewer max_tokens. You requested up to 65535 tokens, but can only afford 3636. To increase, visit https://openrouter.ai/settings/credits and add more credits\",\"code\":402,\""],"candidateCount":2,"acceptedCount":0,"deferredCount":0,"rejectedCount":0,"lastFullAttemptAt":"2026-10-19T10:14:42.592285Z","failedUrls":["https://science.nasa.gov/earth/nasa-satellites-observe-historic-2026-el-nino/","https://www.nasa.gov/missions/moon-base/nasa-jpl-testing-readies-voyager-technologies-lander-for-moon-mission/"],"feedFailed":false,"retryCount":2,"nextRetryAt":"2026-10-19T17:30:03.814548Z"},"esa":{"name":"ESA","staleAfterHours":36,"lastAttemptAt":"2026-10-19T10:14:42.592285Z","lastSuccessAt":"2026-10-19T10:14:42.592285Z","lastNewStoryAt":"2026-10-14T10:00:06.638546Z","errors":[],"candidateCount":15,"acceptedCount":4,"deferredCount":4,"rejectedCount":6,"lastFullAttemptAt":"2026-10-19T10:14:42.592285Z","failedUrls":[],"feedFailed":false,"retryCount":0,"nextRetryAt":null},"nsf":{"name":"NSF","staleAfterHours":36,"lastAttemptAt":"2026-10-19T10:14:42.592285Z","lastSuccessAt":"2026-10-19T10:14:42.592285Z","lastNewStoryAt":"2026-10-14T10:00:06.638546Z","errors":[],"candidateCount":15,"acceptedCount":0,"deferredCount":8,"rejectedCount":3,"lastFullAttemptAt":"2026-10-19T10:14:42.592285Z","failedUrls":[],"feedFailed":false,"retryCount":0,"nextRetryAt":null},"umich":{"name":"University of Michigan News","staleAfterHours":36,"lastAttemptAt":"2026-10-19T10:14:42.592285Z","lastSuccessAt":"2026-10-19T10:14:42.592285Z","lastNewStoryAt":"2026-10-17T10:01:38.386991Z","errors":[],"candidateCount":20,"acceptedCount":4,"deferredCount":16,"rejectedCount":0,"lastFullAttemptAt":"2026-10-19T10:14:42.592285Z","failedUrls":[],"feedFailed":false,"retryCount":0,"nextRetryAt":null}},"error":"Incomplete source checks: jpl","metrics":{"verifiedStories":74,"sourceCounts":{"ESA":9,"NASA":28,"NASA JPL":10,"NSF":9,"University of Michigan News":18},"topicCounts":{"astronomy":35,"biology":10,"climate":2,"computer-science":1,"earth-science":17,"ecology":1,"economics":1,"education":1,"environment":4,"geology":1,"health":9,"human dimensions":1,"law":1,"law & politics":2,"materials-research":1,"physics":21,"planetary science":1,"planetary-science":1,"politics":2,"social-science":12,"sustainability":1,"technology":43,"wildfires":1},"newestStoryAgeHours":11.42,"maxPublicationLagHours":1114.28}}