{"schemaVersion":"1.0.0","generatedAt":"2026-10-30T10:01:04.491389Z","status":"partial","lastSuccessfulCheckAt":"2026-10-18T20:05:50.950465Z","documentGeneratedAt":"2026-10-30T10:01:04.491389Z","newestVerifiedStoryAt":"2026-10-30T04:05:00Z","sources":{"nasa":{"name":"NASA","staleAfterHours":36,"lastAttemptAt":"2026-10-30T10:01:04.491389Z","lastSuccessAt":"2026-10-30T10:01:04.491389Z","lastNewStoryAt":"2026-10-30T10:01:04.491389Z","errors":["https://science.nasa.gov/earth/earth-observatory/vega-island-frozen-in-fright/: LLMError: TimeoutError: The read operation timed out"],"candidateCount":10,"acceptedCount":3,"deferredCount":6,"rejectedCount":0,"lastFullAttemptAt":"2026-10-30T10:01:04.491389Z","failedUrls":["https://science.nasa.gov/earth/earth-observatory/vega-island-frozen-in-fright/"],"feedFailed":false,"retryCount":27,"nextRetryAt":"2026-10-30T16:01:04.491389Z"},"jpl":{"name":"NASA JPL","staleAfterHours":36,"lastAttemptAt":"2026-10-30T10:01:04.491389Z","lastSuccessAt":"2026-10-30T10:01:04.491389Z","lastNewStoryAt":"2026-10-30T10:01:04.491389Z","errors":["https://www.nasa.gov/missions/mars-2020-perseverance/nasas-perseverance-offers-clues-to-protect-crews-from-mars-dust/: LLMError: IncompleteRead: IncompleteRead(143 bytes read)","https://www.nasa.gov/centers-and-facilities/jpl/nasa-jpl-looks-to-next-90-years-of-innovation-exploration/: LLMError: TimeoutError: The read operation timed out"],"candidateCount":10,"acceptedCount":2,"deferredCount":5,"rejectedCount":0,"lastFullAttemptAt":"2026-10-30T10:01:04.491389Z","failedUrls":["https://www.nasa.gov/missions/mars-2020-perseverance/nasas-perseverance-offers-clues-to-protect-crews-from-mars-dust/","https://www.nasa.gov/centers-and-facilities/jpl/nasa-jpl-looks-to-next-90-years-of-innovation-exploration/"],"feedFailed":false,"retryCount":30,"nextRetryAt":"2026-10-30T16:01:04.491389Z"},"esa":{"name":"ESA","staleAfterHours":36,"lastAttemptAt":"2026-10-30T10:01:04.491389Z","lastSuccessAt":"2026-10-30T10:01:04.491389Z","lastNewStoryAt":"2026-10-29T10:00:35.738305Z","errors":["https://www.esa.int/Science_Exploration/Space_Science/Webb/Ghostly_Cat_s_Head_Nebula_lurks_within_sight_of_Hubble_and_Webb: LLMError: TimeoutError: The read operation timed out","https://www.esa.int/ESA_Multimedia/Images/2026/10/MMX_lifts_off_to_Mars_s_moon_Phobos: ValueError: evidence classification requires an article quote"],"candidateCount":15,"acceptedCount":1,"deferredCount":7,"rejectedCount":4,"lastFullAttemptAt":"2026-10-30T10:01:04.491389Z","failedUrls":["https://www.esa.int/Science_Exploration/Space_Science/Webb/Ghostly_Cat_s_Head_Nebula_lurks_within_sight_of_Hubble_and_Webb","https://www.esa.int/ESA_Multimedia/Images/2026/10/MMX_lifts_off_to_Mars_s_moon_Phobos"],"feedFailed":false,"retryCount":27,"nextRetryAt":"2026-10-30T16:01:04.491389Z"},"nsf":{"name":"NSF","staleAfterHours":36,"lastAttemptAt":"2026-10-30T10:01:04.491389Z","lastSuccessAt":"2026-10-30T10:01:04.491389Z","lastNewStoryAt":"2026-10-29T05:30:05.908168Z","errors":[],"candidateCount":15,"acceptedCount":0,"deferredCount":9,"rejectedCount":2,"lastFullAttemptAt":"2026-10-30T10:01:04.491389Z","failedUrls":[],"feedFailed":false,"retryCount":0,"nextRetryAt":null},"umich":{"name":"University of Michigan News","staleAfterHours":36,"lastAttemptAt":"2026-10-30T10:01:04.491389Z","lastSuccessAt":"2026-10-30T10:01:04.491389Z","lastNewStoryAt":"2026-10-30T10:01:04.491389Z","errors":[],"candidateCount":20,"acceptedCount":4,"deferredCount":16,"rejectedCount":0,"lastFullAttemptAt":"2026-10-30T10:01:04.491389Z","failedUrls":[],"feedFailed":false,"retryCount":0,"nextRetryAt":null}},"error":"Incomplete source checks: nasa, jpl, esa","metrics":{"verifiedStories":94,"sourceCounts":{"ESA":12,"NASA":36,"NASA JPL":12,"NSF":9,"University of Michigan News":25},"topicCounts":{"astronomy":48,"biology":11,"climate":2,"climatology":1,"computer-science":1,"earth-science":24,"ecology":1,"economics":2,"education":3,"environment":4,"geology":1,"health":13,"human dimensions":1,"law":1,"law & politics":2,"materials-research":1,"physics":27,"planetary science":1,"planetary-science":1,"politics":2,"social-science":17,"sustainability":1,"technology":48,"wildfires":1},"newestStoryAgeHours":5.93,"maxPublicationLagHours":1114.28}}