{"schemaVersion":"1.0.0","generatedAt":"2026-10-10T10:16:39.118957Z","status":"ok","lastSuccessfulCheckAt":"2026-10-10T10:16:39.118957Z","documentGeneratedAt":"2026-10-10T10:16:39.118957Z","newestVerifiedStoryAt":"2026-10-10T04:05:00Z","sources":{"nasa":{"name":"NASA","staleAfterHours":36,"lastAttemptAt":"2026-10-10T10:16:39.118957Z","lastSuccessAt":"2026-10-10T10:16:39.118957Z","lastNewStoryAt":"2026-10-10T10:16:39.118957Z","errors":[],"candidateCount":10,"acceptedCount":3,"deferredCount":0,"rejectedCount":1},"jpl":{"name":"NASA JPL","staleAfterHours":36,"lastAttemptAt":"2026-10-10T10:16:39.118957Z","lastSuccessAt":"2026-10-10T10:16:39.118957Z","lastNewStoryAt":"2026-10-10T10:16:39.118957Z","errors":[],"candidateCount":10,"acceptedCount":1,"deferredCount":0,"rejectedCount":2},"esa":{"name":"ESA","staleAfterHours":36,"lastAttemptAt":"2026-10-10T10:16:39.118957Z","lastSuccessAt":"2026-10-10T10:16:39.118957Z","lastNewStoryAt":"2026-10-10T10:16:39.118957Z","errors":[],"candidateCount":15,"acceptedCount":4,"deferredCount":4,"rejectedCount":3},"nsf":{"name":"NSF","staleAfterHours":36,"lastAttemptAt":"2026-10-10T10:16:39.118957Z","lastSuccessAt":"2026-10-10T10:16:39.118957Z","lastNewStoryAt":"2026-10-10T10:16:39.118957Z","errors":[],"candidateCount":15,"acceptedCount":3,"deferredCount":3,"rejectedCount":1},"umich":{"name":"University of Michigan News","staleAfterHours":36,"lastAttemptAt":"2026-10-10T10:16:39.118957Z","lastSuccessAt":"2026-10-10T10:16:39.118957Z","lastNewStoryAt":"2026-10-10T10:16:39.118957Z","errors":[],"candidateCount":20,"acceptedCount":2,"deferredCount":8,"rejectedCount":2}},"metrics":{"verifiedStories":38,"sourceCounts":{"ESA":8,"NASA":8,"NASA JPL":8,"NSF":9,"University of Michigan News":5},"topicCounts":{"astronomy":22,"biology":2,"computer-science":1,"earth-science":10,"economics":1,"engineering":2,"geology":1,"health":3,"law":3,"materials-research":1,"physics":15,"planetary-science":1,"politics":1,"social-science":5,"technology":25},"newestStoryAgeHours":6.19,"maxPublicationLagHours":1114.28}}