{"schemaVersion":"1.0.0","generatedAt":"2026-10-30T05:45:09.169147Z","status":"partial","lastSuccessfulCheckAt":"2026-10-18T20:05:50.950465Z","documentGeneratedAt":"2026-10-30T05:45:09.169147Z","newestVerifiedStoryAt":"2026-10-29T04:05:00Z","sources":{"nasa":{"name":"NASA","staleAfterHours":36,"lastAttemptAt":"2026-10-30T05:45:09.169147Z","lastSuccessAt":"2026-10-29T10:00:35.738305Z","lastNewStoryAt":"2026-10-29T10:00:35.738305Z","errors":["https://www.nasa.gov/centers-and-facilities/jpl/caltech-names-artemis-ii-commander-reid-wiseman-as-nasa-jpl-deputy/: LLMError: TimeoutError: The read operation timed out"],"candidateCount":1,"acceptedCount":0,"deferredCount":0,"rejectedCount":0,"lastFullAttemptAt":"2026-10-29T10:00:35.738305Z","failedUrls":["https://www.nasa.gov/centers-and-facilities/jpl/caltech-names-artemis-ii-commander-reid-wiseman-as-nasa-jpl-deputy/"],"feedFailed":false,"retryCount":26,"nextRetryAt":"2026-10-30T11:45:09.169147Z"},"jpl":{"name":"NASA JPL","staleAfterHours":36,"lastAttemptAt":"2026-10-30T05:45:09.169147Z","lastSuccessAt":"2026-10-29T10:00:35.738305Z","lastNewStoryAt":"2026-10-29T05:30:05.908168Z","errors":["https://www.nasa.gov/centers-and-facilities/jpl/nasa-jpl-looks-to-next-90-years-of-innovation-exploration/: LLMError: TimeoutError: The read operation timed out"],"candidateCount":2,"acceptedCount":0,"deferredCount":0,"rejectedCount":1,"lastFullAttemptAt":"2026-10-29T10:00:35.738305Z","failedUrls":["https://www.nasa.gov/centers-and-facilities/jpl/nasa-jpl-looks-to-next-90-years-of-innovation-exploration/"],"feedFailed":false,"retryCount":29,"nextRetryAt":"2026-10-30T11:45:09.169147Z"},"esa":{"name":"ESA","staleAfterHours":36,"lastAttemptAt":"2026-10-30T05:45:09.169147Z","lastSuccessAt":"2026-10-29T10:00:35.738305Z","lastNewStoryAt":"2026-10-29T10:00:35.738305Z","errors":["https://www.esa.int/ESA_Multimedia/Images/2026/10/MMX_lifts_off_to_Mars_s_moon_Phobos: ValueError: evidence classification requires an article quote","https://www.esa.int/Science_Exploration/Space_Science/Euclid/Euclid_discovers_new_comet: LLMError: TimeoutError: The read operation timed out"],"candidateCount":2,"acceptedCount":0,"deferredCount":0,"rejectedCount":0,"lastFullAttemptAt":"2026-10-29T10:00:35.738305Z","failedUrls":["https://www.esa.int/ESA_Multimedia/Images/2026/10/MMX_lifts_off_to_Mars_s_moon_Phobos","https://www.esa.int/Science_Exploration/Space_Science/Euclid/Euclid_discovers_new_comet"],"feedFailed":false,"retryCount":26,"nextRetryAt":"2026-10-30T11:45:09.169147Z"},"nsf":{"name":"NSF","staleAfterHours":36,"lastAttemptAt":"2026-10-29T10:00:35.738305Z","lastSuccessAt":"2026-10-29T10:00:35.738305Z","lastNewStoryAt":"2026-10-29T05:30:05.908168Z","errors":[],"candidateCount":15,"acceptedCount":1,"deferredCount":6,"rejectedCount":5,"lastFullAttemptAt":"2026-10-29T10:00:35.738305Z","failedUrls":[],"feedFailed":false,"retryCount":0,"nextRetryAt":null},"umich":{"name":"University of Michigan News","staleAfterHours":36,"lastAttemptAt":"2026-10-30T05:45:09.169147Z","lastSuccessAt":"2026-10-29T10:00:35.738305Z","lastNewStoryAt":"2026-10-29T10:00:35.738305Z","errors":["https://news.umich.edu/most-of-michigans-local-leaders-say-democracy-is-healthy-in-their-communities-u-m-survey-finds/: LLMError: TimeoutError: The read operation timed out"],"candidateCount":1,"acceptedCount":0,"deferredCount":0,"rejectedCount":0,"lastFullAttemptAt":"2026-10-29T10:00:35.738305Z","failedUrls":["https://news.umich.edu/most-of-michigans-local-leaders-say-democracy-is-healthy-in-their-communities-u-m-survey-finds/"],"feedFailed":false,"retryCount":26,"nextRetryAt":"2026-10-30T11:45:09.169147Z"}},"error":"Incomplete source checks: nasa, jpl, esa, umich","metrics":{"verifiedStories":89,"sourceCounts":{"ESA":12,"NASA":33,"NASA JPL":11,"NSF":9,"University of Michigan News":24},"topicCounts":{"astronomy":44,"biology":11,"climate":2,"climatology":1,"computer-science":1,"earth-science":21,"ecology":1,"economics":2,"education":2,"environment":4,"geology":1,"health":13,"human dimensions":1,"law":1,"law & politics":2,"materials-research":1,"physics":24,"planetary science":1,"planetary-science":1,"politics":2,"social-science":16,"sustainability":1,"technology":47,"wildfires":1},"newestStoryAgeHours":25.67,"maxPublicationLagHours":1114.28}}