{"schemaVersion":"1.0.0","generatedAt":"2026-10-12T21:09:35.027780Z","status":"error","lastSuccessfulCheckAt":"2026-10-10T10:16:39.118957Z","documentGeneratedAt":"2026-10-10T10:16:39.118957Z","newestVerifiedStoryAt":"2026-10-10T04:05:00Z","sources":{"nasa":{"name":"NASA","staleAfterHours":36,"lastAttemptAt":"2026-10-12T21:09:35.027780Z","lastSuccessAt":"2026-10-12T21:09:35.027780Z","lastNewStoryAt":"2026-10-12T21:09:35.027780Z","errors":[],"candidateCount":10,"acceptedCount":4,"deferredCount":6,"rejectedCount":0},"jpl":{"name":"NASA JPL","staleAfterHours":36,"lastAttemptAt":"2026-10-12T21:09:35.027780Z","lastSuccessAt":"2026-10-12T21:09:35.027780Z","lastNewStoryAt":"2026-10-10T10:16:39.118957Z","errors":[],"candidateCount":10,"acceptedCount":4,"deferredCount":3,"rejectedCount":3},"esa":{"name":"ESA","staleAfterHours":36,"lastAttemptAt":"2026-10-12T21:09:35.027780Z","lastSuccessAt":"2026-10-12T21:09:35.027780Z","lastNewStoryAt":"2026-10-10T10:16:39.118957Z","errors":["https://www.esa.int/Science_Exploration/Space_Science/Mars_Express/Mars_s_oddest_cloud_may_be_even_odder_than_we_thought: ValueError: finding quote not present in article","https://www.esa.int/ESA_Multimedia/Images/2026/10/Webb_captures_commotion_from_nebula_s_stellar_jets: ValueError: finding quote not present in article","https://www.esa.int/Science_Exploration/Space_Science/Smile/Science_begins_for_Smile: ValueError: evidence classification requires an article quote"],"candidateCount":15,"acceptedCount":1,"deferredCount":8,"rejectedCount":3},"nsf":{"name":"NSF","staleAfterHours":36,"lastAttemptAt":"2026-10-12T21:09:35.027780Z","lastSuccessAt":"2026-10-10T10:16:39.118957Z","lastNewStoryAt":"2026-10-10T10:16:39.118957Z","errors":["HTTPError: HTTP Error 403: "],"candidateCount":0,"acceptedCount":0,"deferredCount":0,"rejectedCount":0},"umich":{"name":"University of Michigan News","staleAfterHours":36,"lastAttemptAt":"2026-10-12T21:09:35.027780Z","lastSuccessAt":"2026-10-12T21:09:35.027780Z","lastNewStoryAt":"2026-10-12T21:09:35.027780Z","errors":["https://news.umich.edu/as-voters-weigh-incumbents-u-m-research-complicates-case-for-congressional-term-limits/: ValueError: caveatQuote not present in article"],"candidateCount":20,"acceptedCount":2,"deferredCount":16,"rejectedCount":1}},"error":"ValueError: incomplete refresh: esa, nsf, umich","metrics":{"verifiedStories":38,"sourceCounts":{"ESA":8,"NASA":8,"NASA JPL":8,"NSF":9,"University of Michigan News":5},"topicCounts":{"astronomy":22,"biology":2,"computer-science":1,"earth-science":10,"economics":1,"engineering":2,"geology":1,"health":3,"law":3,"materials-research":1,"physics":15,"planetary-science":1,"politics":1,"social-science":5,"technology":25},"newestStoryAgeHours":65.08,"maxPublicationLagHours":1114.28}}