{"schemaVersion":"1.0.0","generatedAt":"2026-10-13T16:42:20.049697Z","status":"partial","lastSuccessfulCheckAt":"2026-10-10T10:16:39.118957Z","documentGeneratedAt":"2026-10-13T16:42:20.049697Z","newestVerifiedStoryAt":"2026-10-13T04:05:00Z","sources":{"nasa":{"name":"NASA","staleAfterHours":36,"lastAttemptAt":"2026-10-13T10:00:01.886016Z","lastSuccessAt":"2026-10-13T10:00:01.886016Z","lastNewStoryAt":"2026-10-13T10:00:01.886016Z","errors":[],"candidateCount":10,"acceptedCount":3,"deferredCount":2,"rejectedCount":1,"lastFullAttemptAt":"2026-10-13T10:00:01.886016Z"},"jpl":{"name":"NASA JPL","staleAfterHours":36,"lastAttemptAt":"2026-10-13T16:42:20.049697Z","lastSuccessAt":"2026-10-13T10:00:01.886016Z","lastNewStoryAt":"2026-10-10T10:16:39.118957Z","errors":[],"candidateCount":1,"acceptedCount":1,"deferredCount":0,"rejectedCount":0,"lastFullAttemptAt":"2026-10-13T10:00:01.886016Z","failedUrls":[],"feedFailed":false,"retryCount":0,"nextRetryAt":null},"esa":{"name":"ESA","staleAfterHours":36,"lastAttemptAt":"2026-10-13T16:42:20.049697Z","lastSuccessAt":"2026-10-13T10:00:01.886016Z","lastNewStoryAt":"2026-10-10T10:16:39.118957Z","errors":["https://www.esa.int/Science_Exploration/Space_Science/Smile/Science_begins_for_Smile: ValueError: evidence classification requires an article quote"],"candidateCount":2,"acceptedCount":1,"deferredCount":0,"rejectedCount":0,"lastFullAttemptAt":"2026-10-13T10:00:01.886016Z","failedUrls":["https://www.esa.int/Science_Exploration/Space_Science/Smile/Science_begins_for_Smile"],"feedFailed":false,"retryCount":1,"nextRetryAt":"2026-10-13T17:42:20.049697Z"},"nsf":{"name":"NSF","staleAfterHours":36,"lastAttemptAt":"2026-10-13T16:42:20.049697Z","lastSuccessAt":"2026-10-13T16:42:20.049697Z","lastNewStoryAt":"2026-10-10T10:16:39.118957Z","errors":["https://www.nsf.gov/news/podcast-can-prosthetic-limbs-feel-touch-haptic-feedback: retry deferred by article budget","https://www.nsf.gov/news/nsf-invests-translating-low-dimensional-semiconductor: retry deferred by article budget","https://www.nsf.gov/news/nsf-announces-3-additional-topics-part-nsf-x-labs-initiative: retry deferred by article budget","https://www.nsf.gov/news/podcast-creating-thermal-cloaking-new-structures: retry deferred by article budget","https://www.nsf.gov/news/nsf-launches-20m-pilot-accelerate-commercialization: retry deferred by article budget","https://www.nsf.gov/news/nsf-leadership-new-golden-age-science: retry deferred by article budget","https://www.nsf.gov/news/podcast-ai-wearable-devices: retry deferred by article budget","https://www.nsf.gov/news/podcast-lasers-materials-future: retry deferred by article budget"],"candidateCount":15,"acceptedCount":0,"deferredCount":8,"rejectedCount":3,"lastFullAttemptAt":"2026-10-13T10:00:01.886016Z","failedUrls":["https://www.nsf.gov/news/podcast-can-prosthetic-limbs-feel-touch-haptic-feedback","https://www.nsf.gov/news/nsf-invests-translating-low-dimensional-semiconductor","https://www.nsf.gov/news/nsf-announces-3-additional-topics-part-nsf-x-labs-initiative","https://www.nsf.gov/news/podcast-creating-thermal-cloaking-new-structures","https://www.nsf.gov/news/nsf-launches-20m-pilot-accelerate-commercialization","https://www.nsf.gov/news/nsf-leadership-new-golden-age-science","https://www.nsf.gov/news/podcast-ai-wearable-devices","https://www.nsf.gov/news/podcast-lasers-materials-future"],"feedFailed":false,"retryCount":1,"nextRetryAt":"2026-10-13T17:42:20.049697Z"},"umich":{"name":"University of Michigan News","staleAfterHours":36,"lastAttemptAt":"2026-10-13T16:42:20.049697Z","lastSuccessAt":"2026-10-13T10:00:01.886016Z","lastNewStoryAt":"2026-10-13T10:00:01.886016Z","errors":["https://news.umich.edu/as-voters-weigh-incumbents-u-m-research-complicates-case-for-congressional-term-limits/: ValueError: caveatQuote not present in article"],"candidateCount":1,"acceptedCount":0,"deferredCount":0,"rejectedCount":0,"lastFullAttemptAt":"2026-10-13T10:00:01.886016Z","failedUrls":["https://news.umich.edu/as-voters-weigh-incumbents-u-m-research-complicates-case-for-congressional-term-limits/"],"feedFailed":false,"retryCount":1,"nextRetryAt":"2026-10-13T17:42:20.049697Z"}},"error":"Incomplete source checks: esa, nsf, umich","metrics":{"verifiedStories":47,"sourceCounts":{"ESA":8,"NASA":14,"NASA JPL":8,"NSF":9,"University of Michigan News":8},"topicCounts":{"astronomy":23,"biology":4,"climate":1,"computer-science":1,"earth-science":12,"economics":1,"education":1,"engineering":2,"geology":2,"health":4,"law":2,"law & politics":1,"materials-research":1,"physics":14,"planetary-science":1,"politics":2,"social-science":5,"technology":26},"newestStoryAgeHours":12.62,"maxPublicationLagHours":1114.28}}